{
  "schema_version": "rag-qna-dataset.v1",
  "dataset_id": "gutenberg-five-books-qna-pilot",
  "revision": "2026-09-14.v1",
  "segment_revision": "qna-segments.v1",
  "family_revision": "qna-families.v1",
  "content_hash": "5b702a79fe72332311ebe49e66b85079c633dd89048e612a83f23d4b153f30cb",
  "evidence_status": "proposed",
  "human_review_status": "pending",
  "operational_admission": false,
  "heldout_scored_proof": false,
  "notes": [
    "Drafted seed pilot, not human-reviewed quality ground truth. Expected answers and rubrics are proposed.",
    "Development/holdout names are family-aware design partitions only, not evidence of a sealed or scored held-out experiment.",
    "Families were manually drafted to avoid close paraphrases across partitions; semantic leakage has not been independently reviewed.",
    "Legacy golden_set.rag.json remains a separate keyword-substring diagnostic, not a human-reviewed acceptance set.",
    "Unanswerable cases name the searched source scope; a locator is not proof that an absent fact was exhaustively ruled out.",
    "Local source hashes establish byte integrity, not source authentication. No corpus passages are copied into this dataset.",
    "Five cases per segment are insufficient for decision-grade quality floors, calibrated tail-risk claims, or production promotion."
  ],
  "sources": [
    {"source_id": "pg1342", "file": "pg1342.txt", "title": "Pride and Prejudice", "sha256": "6542952d9e0df48e86ba83cbd0090b5d19047a0b651d4de724750f1aee5ab9ea"},
    {"source_id": "pg84", "file": "pg84.txt", "title": "Frankenstein", "sha256": "d5f201b59928b643ee77ecc4328d1b20acba5baa169c8a470ca13810fca3a751"},
    {"source_id": "pg345", "file": "pg345.txt", "title": "Dracula", "sha256": "4a4c043649ee733da0f2eee65bd38eea70775eeb44f530f58f1042448010f80a"},
    {"source_id": "pg1661", "file": "pg1661.txt", "title": "The Adventures of Sherlock Holmes", "sha256": "92a451294b188159db12c46f10d576dafa7159e37c64c610abb8a103b2ce3827"},
    {"source_id": "pg11", "file": "pg11.txt", "title": "Alice's Adventures in Wonderland", "sha256": "6b9af8325db3adaf54fc72879bd3586c1869fb65bd018ac4f0fb6008149f3234"}
  ],
  "cases": [
    {
      "case_id": "qna-f01", "family_id": "bennet-inheritance", "segment_id": "factual", "partition": "development",
      "question": "Who is expected to inherit Longbourn instead of Mr. Bennet's daughters, and what legal arrangement explains this?",
      "expected_answer": "Mr. Collins is the expected heir because the estate is entailed away from the female line.",
      "rubric": ["Identify Mr. Collins, not Mr. Darcy or Mr. Bingley.", "Explain the entail without suggesting that the daughters freely renounce the estate.", "Cite the relevant Longbourn inheritance discussion."],
      "source_locators": [{"source_id": "pg1342", "locator": "Chapter 13; Mr. Bennet introduces the expected visit from Mr. Collins and the entail."}],
      "answer_behavior": "answer", "expected_answer_status": "proposed", "human_review_status": "pending"
    },
    {
      "case_id": "qna-f02", "family_id": "demeter-arrival", "segment_id": "factual", "partition": "development",
      "question": "Name the ship that arrives at Whitby during the storm in Dracula, and describe the captain's condition when it is found.",
      "expected_answer": "The Demeter arrives at Whitby; its dead captain is tied to the wheel.",
      "rubric": ["Identify the Demeter and Whitby.", "Distinguish the dead captain from the missing crew.", "Cite the newspaper account or ship's log."],
      "source_locators": [{"source_id": "pg345", "locator": "Chapter VII; Dailygraph storm account and Log of the Demeter."}],
      "answer_behavior": "answer", "expected_answer_status": "proposed", "human_review_status": "pending"
    },
    {
      "case_id": "qna-f03", "family_id": "wonderland-holmes-evidence", "segment_id": "factual", "partition": "holdout",
      "question": "In the Queen's croquet game, which animals serve as mallets and balls?",
      "expected_answer": "Live flamingos are used as mallets and live hedgehogs as balls.",
      "rubric": ["Correctly map flamingos to mallets and hedgehogs to balls.", "Do not substitute the soldiers, who form the arches.", "Cite the croquet scene."],
      "source_locators": [{"source_id": "pg11", "locator": "Chapter VIII, The Queen's Croquet-Ground; description of the equipment."}],
      "answer_behavior": "answer", "expected_answer_status": "proposed", "human_review_status": "pending"
    },
    {
      "case_id": "qna-f04", "family_id": "victor-university", "segment_id": "factual", "partition": "holdout",
      "question": "At which university does Victor Frankenstein study, and name one professor he encounters there?",
      "expected_answer": "Victor studies at Ingolstadt; either M. Krempe or M. Waldman is a valid professor.",
      "rubric": ["Identify Ingolstadt.", "Accept Krempe or Waldman without requiring both.", "Do not identify Walton as a professor; cite Victor's arrival at university."],
      "source_locators": [{"source_id": "pg84", "locator": "Chapter 3; arrival at Ingolstadt and meetings with Krempe and Waldman."}],
      "answer_behavior": "answer", "expected_answer_status": "proposed", "human_review_status": "pending"
    },
    {
      "case_id": "qna-f05", "family_id": "wonderland-holmes-evidence", "segment_id": "factual", "partition": "holdout",
      "question": "In The Adventure of the Blue Carbuncle, where is the stolen jewel unexpectedly discovered?",
      "expected_answer": "It is discovered inside the crop of a goose prepared by Peterson's wife.",
      "rubric": ["Identify a goose, preferably its crop.", "Distinguish discovery of the jewel from the discarded hat.", "Cite the scene where Peterson returns with the stone."],
      "source_locators": [{"source_id": "pg1661", "locator": "The Adventure of the Blue Carbuncle; Peterson's return after the goose is prepared."}],
      "answer_behavior": "answer", "expected_answer_status": "proposed", "human_review_status": "pending"
    },
    {
      "case_id": "qna-s01", "family_id": "charlotte-pragmatism", "segment_id": "synthesis", "partition": "development",
      "question": "Why does Charlotte Lucas accept Mr. Collins, and how does Elizabeth's response reveal their different views of marriage?",
      "expected_answer": "Charlotte prioritizes a secure home and practical prospects over romantic affection. Elizabeth is dismayed because she expects greater affection and compatibility.",
      "rubric": ["Explain Charlotte's economic and social pragmatism without claiming she is in love with Collins.", "Contrast Elizabeth's view using the proposal aftermath.", "Support the interpretation with source evidence, not modern assumptions alone."],
      "source_locators": [{"source_id": "pg1342", "locator": "Chapters 22-23; Charlotte's engagement and conversation with Elizabeth."}],
      "answer_behavior": "answer", "expected_answer_status": "proposed", "human_review_status": "pending"
    },
    {
      "case_id": "qna-s02", "family_id": "holmes-bennet-evidence", "segment_id": "synthesis", "partition": "development",
      "question": "Explain why the Red-Headed League pays Wilson to copy an encyclopedia and how Holmes connects that job to the crime.",
      "expected_answer": "The job keeps Wilson away from his shop while his assistant and accomplice dig a tunnel toward the bank. Holmes links the assistant's behavior, premises, and nearby bank to the planned robbery.",
      "rubric": ["Explain the job as a diversion rather than a genuine charitable task.", "Connect absence from the shop to tunneling and the bank.", "Use the investigation and resolution; distinguish inference from directly observed facts."],
      "source_locators": [{"source_id": "pg1661", "locator": "The Red-Headed League; Wilson's work, Holmes's street inspection, and bank-cellar resolution."}],
      "answer_behavior": "answer", "expected_answer_status": "proposed", "human_review_status": "pending"
    },
    {
      "case_id": "qna-s03", "family_id": "mina-information-work", "segment_id": "synthesis", "partition": "development",
      "question": "How does Mina's work organizing the group's records help the pursuit of Dracula?",
      "expected_answer": "Mina types, transcribes, and collates accounts, including Seward's recordings, making scattered experiences available to the group as a shared chronology and evidence.",
      "rubric": ["Describe concrete organizational work rather than merely calling Mina intelligent.", "Explain how shared records support coordination.", "Avoid claiming the records alone defeat Dracula."],
      "source_locators": [{"source_id": "pg345", "locator": "Chapters XIV and XVII-XVIII; Mina's typewriting, phonograph transcription, and shared records."}],
      "answer_behavior": "answer", "expected_answer_status": "proposed", "human_review_status": "pending"
    },
    {
      "case_id": "qna-s04", "family_id": "creature-social-learning", "segment_id": "synthesis", "partition": "holdout",
      "question": "How does observing the De Lacey household educate the creature, and why does approaching the family fail to secure companionship?",
      "expected_answer": "He learns language and human relationships by watching the family, including lessons given to Safie. The blind father initially listens, but the returning family reacts fearfully or violently to his appearance.",
      "rubric": ["Connect observation and Safie's lessons to learning.", "Distinguish the blind father's response from the sighted family's response.", "Explain the failed hope of companionship without erasing the creature's agency."],
      "source_locators": [{"source_id": "pg84", "locator": "Chapters 12-15; cottage observations, Safie's lessons, and encounter with blind De Lacey."}],
      "answer_behavior": "answer", "expected_answer_status": "proposed", "human_review_status": "pending"
    },
    {